{
  "$schema": "https://endroit.org/schema/asset.json",
  "name": "endroit/research",
  "version": "0.7.0-alpha.0",
  "description": "Reusable evidence-backed research continuity owned by one Workspace.",
  "prefix": "research",
  "workspaceNamespace": "researching",
  "files": [
    "capabilities/study.md",
    "capabilities/revalidate.md",
    "templates/study.md"
  ],
  "capabilities": [
    {
      "id": "study",
      "path": "capabilities/study.md",
      "description": "Create or continue one bounded evidence-backed Study."
    },
    {
      "id": "revalidate",
      "path": "capabilities/revalidate.md",
      "description": "Refresh volatile evidence in an existing Study."
    }
  ],
  "skills": [
    {
      "id": "study",
      "capability": "study",
      "description": "Use when a bounded research question should become reusable Workspace evidence."
    },
    {
      "id": "revalidate",
      "capability": "revalidate",
      "description": "Use when volatile evidence in an existing Study must be revalidated."
    }
  ],
  "commands": [
    {
      "id": "study",
      "capability": "study",
      "description": "Create or continue a research Study."
    },
    {
      "id": "revalidate",
      "capability": "revalidate",
      "description": "Revalidate an existing research Study."
    }
  ]
}
