{
  "$schema": "https://endroit.org/schema/asset.json",
  "name": "endroit/onboarding",
  "version": "0.7.0-alpha.0",
  "description": "A consent-first orientation for a new Endroit Home or Desk.",
  "prefix": "endroit",
  "files": [
    "capabilities/onboard.md",
    "schemas/desk-settings.schema.json"
  ],
  "capabilities": [
    {
      "id": "onboard",
      "path": "capabilities/onboard.md",
      "description": "Configure the smallest useful Home and Desk through conversation."
    }
  ],
  "commands": [
    {
      "id": "onboarding",
      "capability": "onboard",
      "description": "Configure this Home and your Desk through a consent-first conversation."
    }
  ],
  "settings": {
    "desk": "schemas/desk-settings.schema.json"
  }
}
