{
  "$schema": "https://endroit.org/schema/asset.json",
  "name": "endroit/artifacts",
  "version": "0.7.0-alpha.0",
  "description": "The generic lifecycle for inspectable Workspace-owned Artifacts and explicit projections.",
  "prefix": "endroit",
  "files": [
    "capabilities/manage.md",
    "schemas/artifact.schema.json",
    "runtime.mjs"
  ],
  "capabilities": [
    {
      "id": "manage",
      "path": "capabilities/manage.md",
      "description": "Create, inspect, validate and promote Workspace-owned Artifacts."
    }
  ],
  "skills": [
    {
      "id": "artifacts",
      "capability": "manage",
      "description": "Use when work should become an explicit, inspectable Artifact."
    }
  ],
  "commands": [
    {
      "id": "artifacts",
      "capability": "manage",
      "description": "Manage Endroit Artifacts."
    }
  ],
  "runtime": {
    "namespace": "artifact",
    "entry": "runtime.mjs",
    "commands": [
      { "name": "create", "description": "Create an Artifact, optionally importing a directory." },
      { "name": "list", "description": "List Workspace Artifacts, legacy roots and Target projections." },
      { "name": "inspect", "description": "Inspect one Artifact." },
      { "name": "validate", "description": "Validate one Artifact against its owning kind." },
      { "name": "promote", "description": "Promote a Workspace Artifact to a Home Workspace or Target." },
      { "name": "publish", "description": "Deprecated compatibility alias for Artifact promotion." }
    ]
  }
}
