{
  "$schema": "https://endroit.org/schema/asset.json",
  "name": "endroit/scratch",
  "version": "0.7.0-alpha.0",
  "description": "Optional lightweight working memory for uncertain or non-trivial work.",
  "prefix": "endroit",
  "workspaceNamespace": "exploring",
  "files": [
    "capabilities/scratch.md",
    "schemas/scratch.schema.json",
    "templates/scratch.md"
  ],
  "capabilities": [
    {
      "id": "scratch",
      "path": "capabilities/scratch.md",
      "description": "Create or continue lightweight working memory in the Desk."
    }
  ],
  "commands": [
    {
      "id": "scratch",
      "capability": "scratch",
      "description": "Create or continue an Endroit Scratch Artifact."
    }
  ],
  "artifactKinds": [
    {
      "id": "scratch",
      "schema": "schemas/scratch.schema.json",
      "template": "templates/scratch.md",
      "owners": ["desk", "home", "target"],
      "states": ["active", "complete"],
      "targetPath": "docs/scratches"
    }
  ]
}
