{
  "$schema": "https://endroit.org/schema/asset.json",
  "name": "endroit/workspaces",
  "version": "0.7.0-alpha.0",
  "description": "Scoped shared and personal continuity for an Endroit Home.",
  "prefix": "endroit",
  "files": [
    "capabilities/route.md",
    "capabilities/inbox.md",
    "capabilities/decision.md",
    "capabilities/hygiene.md",
    "capabilities/archive.md",
    "templates/workspace.md",
    "templates/inbox.md",
    "templates/decision.md",
    "runtime.mjs"
  ],
  "capabilities": [
    {
      "id": "route",
      "path": "capabilities/route.md",
      "description": "Resolve or create the one Home or Desk Workspace that owns durable work."
    },
    {
      "id": "inbox",
      "path": "capabilities/inbox.md",
      "description": "Capture and route explicitly deferred matter in its owning Workspace."
    },
    {
      "id": "decision",
      "path": "capabilities/decision.md",
      "description": "Record one accepted decision in its owning Workspace."
    },
    {
      "id": "hygiene",
      "path": "capabilities/hygiene.md",
      "description": "Inspect Workspace contracts and propose bounded repairs without implicit cleanup."
    },
    {
      "id": "archive",
      "path": "capabilities/archive.md",
      "description": "Archive or restore inactive Workspace material while preserving one durable copy."
    }
  ],
  "skills": [
    {
      "id": "workspace",
      "capability": "route",
      "description": "Use when durable work needs one explicit shared Home or personal Desk owner."
    },
    {
      "id": "workspace-inbox",
      "capability": "inbox",
      "description": "Use when deferred matter should be captured or reviewed without starting work."
    },
    {
      "id": "workspace-decision",
      "capability": "decision",
      "description": "Use when an accepted decision should become a durable Workspace Document."
    },
    {
      "id": "workspace-hygiene",
      "capability": "hygiene",
      "description": "Use when Workspace structure or ownership needs a read-only hygiene inspection."
    },
    {
      "id": "workspace-archive",
      "capability": "archive",
      "description": "Use when inactive Workspace material must be archived or restored explicitly."
    }
  ],
  "commands": [
    {
      "id": "workspace",
      "capability": "route",
      "description": "Resolve or create a scoped Workspace."
    },
    {
      "id": "workspace-inbox",
      "capability": "inbox",
      "description": "Capture or review Workspace Inbox matter."
    },
    {
      "id": "workspace-decision",
      "capability": "decision",
      "description": "Record an accepted Workspace decision."
    },
    {
      "id": "workspace-hygiene",
      "capability": "hygiene",
      "description": "Inspect Workspace hygiene."
    },
    {
      "id": "workspace-archive",
      "capability": "archive",
      "description": "Archive or restore Workspace material explicitly."
    }
  ],
  "runtime": {
    "namespace": "workspace",
    "entry": "runtime.mjs",
    "commands": [
      {
        "name": "create",
        "description": "Create one atomic Home or Desk Workspace."
      },
      {
        "name": "list",
        "description": "List Workspaces across Home and the current Desk."
      },
      {
        "name": "inspect",
        "description": "Inspect one scoped Workspace."
      },
      {
        "name": "doctor",
        "description": "Check Workspace identity, layout and ownership without mutation."
      }
    ]
  }
}
